{
  "version": "pvs-1",
  "approved": true,
  "reasoning": "Content complies with all evaluated policies. No PII detected, tone is professional, and no financial advice is present.",
  "policy_violations": [],
  "confidence_score": 0.97,
  "policy_set": [
    "No PII leakage",
    "No financial advice",
    "Professional tone",
    "No harmful content"
  ],
  "metadata": {
    "engine": "the-gavel",
    "engine_version": "1.0.0",
    "latency_ms": 520,
    "tenant_id": "tenant-123",
    "agent_id": "support-bot"
  }
}
